file,meeting_title,theme,label,description,quote_text,speaker_mix,label_quote_jaccard,overlap_with_safety_label,generic_admin_label,safety_like_language,fidelity_score_0_2,review_notes
03a609d7-bd48-48aa-a708-650afb1d3a58.json,Orion Forge Industrial // Voxel,other,Retail floor hazard detection to reduce liability exposure,Detect floor hazards and notify staff to reduce customer incident risk and associated liability exposure.,"They had something on the floor that led to a costly customer incident. || With our camera, we are going to see those floor hazards and notify them quickly.",voxel_only,0.04,False,False,True,,
c3ceb91a-e15d-4326-8a39-cfdb26dde294.json,Summit Span Solutions / Voxel Sync,other,Contract renewal language clarification,"Clarify how the existing renewal language works and what written notice could affect in future periods, without preserving the exact clause mechanics.",I want to confirm what our obligations are under the current contract timing. || My understanding is that written notice after the upcoming renewal point could affect a later period. || So written notice could still be submitted shortly after that renewal timing. || And then that notice would be taken into account for the following period.,mixed,0.06060606060606061,False,False,False,,
b5715671-0f5a-4f2a-9584-43420ff6ebc4.json,Cedar Field Materials // Voxel (Camera Assessment),asset_and_loss_prevention,Pilot KPI tracking and weekly reviews,"Define measures of success for the trial, set KPIs, and hold regular (weekly/bi-weekly) reviews to track trends, compare to other organizations, and surface wins in the data.","what are the measures of success? I would love for you to help me build that. How do we track that on a certain frequency? || How does this compare to other organizations? And helping me find the wins in the data would be helpful. || And typically, probably a weekly meeting is probably the best, right?... But we can set those parameters and KPIs, right? || And then we'll put together, you know, a project plan for you that hits on those milestones and has things and deliverables and measurables that we're targeting and working towards together.",mixed,0.01818181818181818,False,True,False,,
980ead37-1d6b-4667-83b2-04150d12e552.json,Bridge Mill Transport / Voxel Bi-Weekly Sync,adoption_and_enablement,Address PIT parking duration impacting aisle flow at central crossway,Monitor and reduce PITs left parked in travel aisles at the central crossway to maintain flow and policy compliance using coaching and write-ups.,"The one area I wanted to highlight with you was parking duration, because that saw a pretty sharp increase this past month. || And it looks like, you know, far and away, the central crossway is the top offender. || No, they're not supposed to. || We coach them or we do a write-up, and it's the back and forth with the union on what's okay.",mixed,0.09523809523809523,False,False,True,,
be401ee4-de53-401a-b1ad-d26e3ae2d018.json,Jetty Steel Systems / Voxel Call,workflow_and_accountability,Distributed area ownership via Boards and tier process,Establish area champions/owners with their own Boards and incorporate reviews into tiered daily/weekly management to avoid bottlenecks.,"we have to create almost like area champions in a way where they have their own dashboard of those areas that they're managing || each of those areas have owners, right? So we could tie that into what you're saying, right? And they could be a daily topic, a weekly topic... incorporate right into our daily management. || you could create as many as you want here, and then you could add a restrict access based on certain folks... they could each have their own board that they kind of land on and engage with and are responsible for.",mixed,0.0196078431372549,False,True,False,,
d5d1c152-b84d-44a3-9ee7-03f31409463c.json,Voxel - Innovation Talk Overview,compliance_and_quality,Automated global regulation monitoring for customs services,Automate integration and monitoring of incoming regulations and compliance updates from global sources for the customs services team.,"So we're looking at how to integrate and automate the regulation monitoring for all incoming or new regulations and compliance from every source in the world, you could say.",customer_only,0.047619047619047616,False,False,False,,
09b3303f-0b38-49f8-8f9c-4d4f74337e9d.json,Mason Line Supply + Voxel,efficiency_and_operations,PIT parking duration monitoring and camera zone tuning,"Track extended PIT parking durations that may reflect normal work (e.g., lunch, labeling) and refine camera zones to exclude expected parking areas.","I think that that has to do with most of the time because they park their vehicle and they go for lunch or they park their vehicle. || So the vehicle will be parked for a while before it's actually moved. || So that I think will always be going up instead of going down. || Yeah, and I think there's also, Harper, there's some fine-tuning we can do on the camera views for where we expect PIT to be parked, because I know that's changed recently, and where we expect freight to sit and where not to sit, because I know today, I painted the brush quite broad to try and capture everything, and then now we're just going to narrow it down a bit to not focus on some of those areas.",customer_only,0.05084745762711865,False,False,True,,
6d7ca0e7-7ecf-4a8c-a148-0e270a28ee89.json,Voxel / Titan Stack Operations - Check-in,reporting_and_analytics,Restore dashboard deep links in daily incident email,Provide direct links in the daily email so leaders can click through to the dashboard as in the previous report format.,"So one, how he was entering to the dashboard was with an email that was sent with the numbers of the incidents. || So he used to just to click there and he was like a link to the dashboard. || That's not possible in the new dashboard report that is being sent every day. || Is to change the report to the to the last version or if it's possible to add the links to the new dashboard report daily? || if you scroll to the bottom of the new email, there is a link that opens to the main dashboard, and we already have follow-up work planned to make navigation from that email easier again.",mixed,0.0851063829787234,False,False,False,,
01c88a52-b251-43eb-bdd9-51c94643c04e.json,Voxel Training- Cassidy @ Cedar Brook Foods,video_and_investigation,Video footage retrieval,Retrieve camera footage from the platform as needed.,"I do do a little bit of footage retrieval, but for the most part, more so technical manager of the system.",customer_only,0.16666666666666666,False,False,False,,
ed7d25b7-2ff1-415d-b27e-fbc76f5084ca.json,Oak Motive Solutions / Voxel Bi-Weekly Sync,adoption_and_enablement,Increase camera coverage for monitoring and business case,Expand camera coverage so critical areas (including seldom-accessed zones) are visible for monitoring and to support the business case for broader deployment.,"We don't have a closer camera right there, and that's what I was thinking about because, actually, the event's not even on camera. || These cameras aggravate me sometimes with this motion detection because it only records whenever it detects motion. || making sure that all of the routinely accessed areas and all the areas that are, you know, not necessarily routinely accessed, but, you know, seldomly accessed, have have coverage that you can leverage, you know, our type of technology for that. || Rich Mills is wanting to increase camera coverage. And this helps, like, feed into that entire business case conversation as to why we need more coverage in the plant besides the several cameras.",mixed,0.07936507936507936,False,True,False,,
cc1e178e-afef-484c-8a75-f025a6f882ec.json,Cobalt Plant Industrial / Voxel pilot discussion,compliance_and_quality,Drone-based remote inspection and auditing,Integrate AI with drones to conduct remote site walkthroughs from the office to audit teams and inspect conditions.,"What about if we do have drones? If we do have drones, can you integrate the system to these drones? || it's a good idea that even from here, if we want to do like a tour or something and make sure that everything in place, I audit my team, I inspect if they're doing their job, I can, I come from here, from my office, I just fly this drone and I just go in my, in my, in my walkthrough.",customer_only,0.025,True,False,False,,
2fb0bc4b-0c18-4eae-8ff8-988e11af0d41.json,Quarry Span Solutions VOXEL AI PARTNERSHIP,other,Restricted access behind registers and counters using rules/uniforms,"Detect non‑employees in restricted zones (e.g., registers, behind counters) using area/time rules and uniform detection to reduce internal theft.","registers? Nobody should be in the registers if you're not an employee, that kind of thing. Behind the counters. Would that be part of this, where you can set up just places and times maybe? || So the rule that I would think about is like, if someone's not wearing an apron, this is a no-pedestrian zone. || We've got a lot of employee theft for just, you know, you're sweeping the broom and the cash is laid out, right?",customer_only,0.06818181818181818,False,False,False,,
fc07344d-07f9-44b8-9cd2-5df1719a946d.json,"Voxel Training- Summit Span Solutions, Northpoint Site",asset_and_loss_prevention,Open door duration monitoring,Track open door duration events for operational awareness and process control.,"overreaching, ergonomic risks, obstruction for certain areas, open door duration, parking duration.",voxel_only,0.3,False,False,False,,
62a46298-0707-4ecf-b2a2-85b40e5ba070.json,Atlas Motive Operations Catchup,asset_and_loss_prevention,Lower workers’ comp premiums by demonstrating improved risk,Leverage the system to help drive lower insurance premiums in future renewals by improving losses and showing a stronger safety culture.,"For you, Harper, or even the guys at Willis, would this help drive, this type of system help drive a lower premium in the future as well, integrating this technology? || Well, I think the hope is that, yeah, you know, your losses improve, and as you become a better risk, yeah, your premiums will be lowered. || overall, if your losses are steadily getting better, then, you know, your premium will be favorable.",customer_only,0.07317073170731707,False,False,True,,
0511afa9-94d6-4a22-a384-11efbef34dfe.json,Voxel Legacy Drive Fabrication,adoption_and_enablement,Merchandising analytics: dwell/end-cap engagement,"Provide insights on where shoppers congregate and how they engage with end caps and sets, including pickup activity, to inform marketing and merchandising decisions.","what areas of the store are being congregated the most. || Where are our shoppers spending the most time when they're in a store location, right? || if I set this end cap that had all this merchandise, tracking the sales of that, tracking how many people are drawn based on the From marketing to that end cap to drive a sale. || How many are picking up from that location?",customer_only,0.05128205128205128,False,False,True,,
d5d1c152-b84d-44a3-9ee7-03f31409463c.json,Voxel - Innovation Talk Overview,workflow_and_accountability,Conversational AI overlay for customs platform,Develop a conversational AI interface on top of the existing customs services platform to improve user interaction.,And then we're also looking at developing like almost like a conversational AI overlay. || to our existing platform that they have for custom services.,customer_only,0.17647058823529413,False,False,False,,
ed7d25b7-2ff1-415d-b27e-fbc76f5084ca.json,Oak Motive Solutions / Voxel Bi-Weekly Sync,other,Maintenance window suppression (no incident capture during scheduled work),Configure the platform to suppress incident capturing during Sunday maintenance windows to reduce noise and false positives.,"So their normal maintenance day is on Sundays. || So we need to add that in to the, no incident capturing Sundays from. || 6A to 6P. || All right. I'll get that added in there.",mixed,0.09090909090909091,False,False,False,,
af1e5ada-5bd5-4ce2-951d-f679daeb15db.json,River Ridge Works | Voxel Sync,other,Integrate with existing cameras and minimize IT burden,"Need clarity on using existing (closed-loop) cameras and a simple, low-lift deployment to avoid purchasing new hardware and to address IT hesitations.","Apparently, they're looking at going away from those anyway, and they're closed loop, and there's some other stuff that they're telling me. || But they had some hesitation on doing certain things with their cameras, so it may be helpful. || They're tied back to our servers, and we're going to talk through it, but I thought they were trying to upgrade what we're doing, or what they're doing, and at least that's the sense I get, but I'm going to talk to them more this week, because my assumption from the beginning of this is, well, we'd be able to tag into whatever we have, and that saves a cost, except I don't want have to go out and buy a bunch of cameras that I didn't think about, and I know we have them, all my plants have them, so I just got to learn more about our IT side and what we need to do there. || We call it a standard phased method. || It's like three questions, several hours of their time. || And within several weeks, we have data flowing.",mixed,0.011111111111111112,False,False,False,,
512af163-fb6a-447d-a767-f0cbb22fca95.json,Voxel - Cobalt Ridge Fabrication,efficiency_and_operations,Conveyor congestion detection for operational efficiency,"Use cameras to detect conveyor backups (pile-ups, no movement) to intervene sooner, reduce downtime, and manage flow beyond safety prevention.","Is there anything where you guys can see where boxes are starting to back up and build a, like, start to build up in a certain line? || To sum that up, there is definitely an operational-efficiency opportunity in addition to the safety piece if material starts to pile up. || a heat map is extremely powerful when you're looking at it in a really busy area, know, sort of at full peak, full production, what do we need to focus on? And we have customers that use those, you know, day in, day out to identify operational bottlenecks",mixed,0.03636363636363636,False,False,True,,
9f23bf36-bb37-4f9f-bbe9-5d7a70759ea9.json,Bridge Mill Transport / Voxel Bi-Weekly Sync,reporting_and_analytics,Year-over-year incident trend reporting and comparison,Generate reports to see trends by area and compare incident volumes year-over-year to quantify improvement.,"see how we're trending in the different areas and see how there's some areas that we've seen notable improvements, some areas that we need to see improvement || is there any way you can tell me from last year, this month, how much, like we have 47,000 right now, but how much we had in the last year on this time? || I want to compare the number to this one that I have right now. || If you go into reports, that's available as well.",customer_only,0.022222222222222223,False,False,False,,
1268cde7-ca63-40df-8139-2f0c1907a21c.json,Voxel / South Track Dynamics Connect,video_and_investigation,Embed incident videos in presentation decks,Insert specific incident videos into slide decks so they play during presentations to showcase examples.,"be able to take a specific video and embed it... I want to showcase this one thing and put it in that, and then allow it to run as a video in the presentation mode, would be great. || if we can provide like a one click to do that, that would be, it sounds like that would be super helpful.",mixed,0.06896551724137931,False,False,False,,
9cf59bde-7476-40cd-98e0-1a29c45a536b.json,Peak Ridge Works + Voxel - Intro Call,video_and_investigation,Automate camera monitoring to save staff time,"They want AI to surface relevant events so employees don’t have to continuously watch video feeds, reducing time wasted on manual monitoring.","So instead of having, we don't have a, I'll call it dedicated person that looks at camera footage, but we have a lot of people that just stare at it and waste a bunch of time. || So I was proactively trying to, I guess, save some of that time. || Like, obviously, we have time savings, you know, from, like you said, you not having people watching cameras all the time.",mixed,0.07894736842105263,False,False,False,,
f3432b37-3049-414d-a90b-1df41934a165.json,Voxel Grit Stack Operations sync,compliance_and_quality,After-hours dock door open alert (lights off),Trigger an alert if building lights are off and a dock door remains open after hours.,"we want to fire an automatic alert if all lights go out in a building and a dock door is still open || So we can do open doors today. But we can add a separate rule that if the lights are turned off, for example, we can flag that.",mixed,0.2222222222222222,False,False,False,,
a1cd5278-e378-441c-a467-aeb78a5b4432.json,Union Track Dynamics / Voxel Monthly Sync,workflow_and_accountability,Site report and heatmap analytics to find hotspots by camera/time and track outcomes,"Leverage the site report to view 30‑day incident trends, drill into specific cameras, use heatmaps to locate hotspots, see hot times, and add markers to track post‑action outcomes.","So this automatically takes a 30-day view for the previous month. || You can see completed actions by type. || A 20-25% spike. || a lot of the events are happening within the first a few cameras. So Aisle Cluster B, Aisle Cluster C || I can open the heat map just to see where this is happening more specifically. || And it looks like, you know, typically Thursdays around 8 p.m.. Central are your hot days",voxel_only,0.0,False,False,False,,
62eb5dc9-c22f-4846-92dd-07743da36faf.json,Voxel Follow Up,adoption_and_enablement,Protect privacy via body blurring to support wider use,Enable anonymized video with body blurring so more users can engage with the platform without recognizing individuals.,We can even go into body blurring if we want them to anonymize completely so that there's no recognition of individuals.,voxel_only,0.125,False,True,False,,
dd077f4c-3e4b-46aa-9945-d8fd10877195.json,Voxel / Vale Bridge Systems Training,workflow_and_accountability,Action tracking and accountability for safety interventions,"Use the Actions workflow to assign responsible owners, add subscribers, set due dates, notify via email, track status through assigned/in progress/completed, and report on completion and impact on event volumes.","So that's really where actions comes into play, and it's a different way of assigning different video clips to folks to focus on specific coaching efforts, but it also gives you more prescriptive next steps with different suggested titles that we offer. || And then in addition, we do have due dates associated with those particular events. || So what this allows you to do if you're assigning something out to somebody is select yourself or a group of other people. || They'll get email notifications when the status gets changed, when it gets assigned. || Is there a way to run a report to see what's open, what's completed? || So what's been assigned, what's in progress is in the middle. || What's completed is on the right. || And there's a couple of things that I could note as well here on this page because it does give you user-by-user information about how many have been generated, who's completed what, what the average completion time is. || Because I think it'll be key for us to track things and moving forward. || there's a marker in your dashboard that goes over the data so you could see thereafter, like, what impact is this having? || Based on what you guys are doing, based on the platform insights, is that actually having an effect? the events going down in volume over time?",mixed,0.0,True,True,True,,
ab25c025-3c1d-4127-8784-51d4c905ea23.json,Stone Peak Manufacturing + Voxel Reconnect,reporting_and_analytics,Enterprise safety analytics and summary view,"Provide enterprise-wide analytics on frequency, location, and timing of events via a summary view for cross-site visibility and decision-making.","what we're pulling to the forefront for you guys is that enterprise visibility into how often, when, and where those things are happening. || for someone like you that oversees multiple facilities, as you go from one to many with Voxel, we have a summary view where all those sites feed into one, right? || And you have that common language of understanding that leading indicator of risk at any point in time.",voxel_only,0.06818181818181818,True,False,True,,
512af163-fb6a-447d-a767-f0cbb22fca95.json,Voxel - Cobalt Ridge Fabrication,asset_and_loss_prevention,Open door duration tracking for turn-time management,"Track dock door open durations during live unloads to monitor turn-time and coordinate staffing/scheduling, while also correlating with risk windows.","it's also possible to turn on open door duration so that if you knew your turnaround time was, for example, no more than, say, under an hour, you wanted the truck to turn around in, you could start the open door duration so you'd have some line of sight to when it's there longer. || And the turn time, like trailer load and unload, that's something we're tackling, like, operationally as well, right?",mixed,0.11904761904761904,False,False,False,,
ac14b2a4-2a18-45c0-9f6d-3956fb2f1e85.json,Jordan/Riley - Introduction,compliance_and_quality,Food hygiene PPE compliance (hair nets and beard nets),Monitor compliance with hair net and beard net requirements for food processing operations.,"We just did like hair nets and beard nets for some of our food, food processors.",voxel_only,0.3076923076923077,False,False,True,,
03a609d7-bd48-48aa-a708-650afb1d3a58.json,Orion Forge Industrial // Voxel,video_and_investigation,Conveyor jam/no-obstruction detection and root-cause review,Use no-obstruction zones and captured video clips to detect conveyor jams and review pre-event footage for diagnosis.,"No obstruction zones, no blocking, like fire exits. You can do that on conveyor belts. || Whatever the duration you want to track, and then when it violates it for like 15, 30 seconds, you get flagged. || once we have a jam eye, we have this trigger event that says, hey, you've got a jam, but I would wonder if there's an ability to go back in time and say, look, this is the five seconds before that jam that happened, right? || wonder if there is a, when we collect that information, if how long the video clip is",mixed,0.05555555555555555,False,True,False,,
1268cde7-ca63-40df-8139-2f0c1907a21c.json,Voxel / South Track Dynamics Connect,reporting_and_analytics,Report subscriptions and exports (PDF/CSV/PPT) for stakeholder sharing,"Subscribe to receive weekly summaries and export dashboards as PDFs, raw CSV data, or editable PowerPoint slides for broader reporting.","we also have options like subscriptions. So being able to say, hey, I want a weekly download of this information sent to my inbox. || the ability to export not only. Like a PDF format of this, but also the raw data || we're looking at three formats. The first being PDF... The second is that raw data exports... The third ... more of like a PowerPoint style export",voxel_only,0.07317073170731707,False,False,False,,
2fb0bc4b-0c18-4eae-8ff8-988e11af0d41.json,Quarry Span Solutions VOXEL AI PARTNERSHIP,adoption_and_enablement,Use Voxel videos in training and explore LMS (Cornerstone) integration,Leverage detected clips for new‑employee training and explore integration with Cornerstone to track training assignments and completion.,"We use a learning management system called Cornerstone. Can this be tied into Cornerstone so we can keep track of training whenever we assign training? Is that a possibility? || New decks or presentations, they have like videos from Voxel, they use that for new employee training. || So you can use our videos for training, but the main purpose is like real-time risk detection and prevention.",customer_only,0.10256410256410256,False,True,False,,
2fb0bc4b-0c18-4eae-8ff8-988e11af0d41.json,Quarry Span Solutions VOXEL AI PARTNERSHIP,asset_and_loss_prevention,No‑pedestrian zone and after‑hours presence monitoring for LP/security,"Use no‑pedestrian zones and time‑based rules to detect unauthorized presence, loitering, and potential shrink in areas like registers, docks, back rooms, and after hours.","No pedestrian zone. This could be used for safety or security. || From a safety perspective here, you're going to see this area right here where the rollers are, and they don't want anyone in the roller area. || Think about your loading docks, your back of buildings, some of those areas where you could potentially have loitering as an issue. You could have some shrink, et cetera.",customer_only,0.07142857142857142,False,False,True,,
6a626eda-a54b-4bbc-a81d-8e11fd41428e.json,Riley/Cleo Check In,compliance_and_quality,Food safety PPE compliance (hair nets and beard nets),Monitor compliance with hair nets and beard nets for food safety and hygiene requirements.,"We also do hair nets and beard nets. || Those are obviously more food safety focused, though potentially relevant.",voxel_only,0.3125,False,False,True,,
