file,meeting_title,theme,label,description,quote_text,speaker_mix,label_quote_jaccard,overlap_with_safety_label,generic_admin_label,safety_like_language,fidelity_score_0_2,review_notes
3a43e278-01b9-4daf-9ee7-978f585cf978.json,(ext) Voxel | Falcon Point Fabrication (LP brief),efficiency_and_operations,Operational productivity and safety program efficiency gains,"Improve operational productivity by reducing lost time and identify efficiency gains in administering safety programs, correlating pre- and post-implementation costs.","From an operational standpoint, you know, over time we can certainly prove out productivity gains. || Generally those are, you know, more related to workers being at work and not actually being out, you know, due to suffering a lost time injury. || But also we can generally identify savings around kind of like the efficiency gains associated with managing safety. || we're often able to, you know, correlate what the cost of that program was to administer in a pre and a post-Voxel state. || how can they be more efficient? || How can they be more productive?",voxel_only,0.10909090909090909,False,False,True,,
1ceceac2-19cc-44fe-98b7-0d94a06160d6.json,Harbor Harbor Supply // Voxel,asset_and_loss_prevention,Reduce shrink by detecting product damage from PIT impacts,Identify forklift collisions and near-misses that nick or damage product to address causes of shrink and product loss.,"Or they nick like a product, and that can also impact shrink. So that could be something that we can track as well.",voxel_only,0.10526315789473684,False,False,True,,
ac14b2a4-2a18-45c0-9f6d-3956fb2f1e85.json,Jordan/Riley - Introduction,efficiency_and_operations,Warehouse productivity via wearable device optimization,Improve picker throughput and reduce downtime by deploying Bluetooth wearables with hot-swappable battery packs.,"it was all Bluetooth compatible with an extra battery pack. || So you would just take out that little battery, replace it super, I think it would last like maybe like four to several hours. || So swapping a half of a battery kind of saved a lot of time, especially with them going back and forth and like, you know, little check stations that we have within the warehouses.",customer_only,0.0,False,False,False,,
096964ad-8b87-401e-933c-984c56c0da56.json,Gray Connect,other,Potential expansion to retail stores,Consider deploying Voxel beyond distribution centers into retail stores.,"I think it's a super smart and effective tool that I think we should use, I think, definitely at our DCs, but maybe in the stores too, which would be cool.",customer_only,0.05,False,False,False,,
62eb5dc9-c22f-4846-92dd-07743da36faf.json,Voxel Follow Up,reporting_and_analytics,Use heatmaps and claims data to target and validate impact,Combine dashboard heatmaps with workers’ comp data to prioritize areas and validate reductions over time for reporting and ROI.,"I know I can go into the dashboard today and see a heat map on overreaches in a certain area and say there's a hot spot. || Getting some injuries or claims around shoulder injuries or strains or repetitive motion, I think we can certainly hone in on where those incidents are occurring via the platform || Or if several months down the road, we would compare to see if our injuries by that type of accident are declining.",mixed,0.02040816326530612,False,False,False,,
909a8d56-b5dc-4b0e-aff9-d097d46a0a58.json,Field Span Transport / Voxel:  Pick up discussions and confirm next steps,other,Product condition and dwell-time detection,Leverage camera-based monitoring to detect products that are out of spec or left in the wrong place for too long to prevent spoilage and reduce downstream issues.,"You know, when it comes to tracking product damage or exploring camera-based monitoring in this area, one example is detecting when a product is out of spec or left where it should not be for too long. || Yeah, and claim-focused, right? || If you're finding something that's out of spec.",mixed,0.030303030303030304,False,False,False,,
be401ee4-de53-401a-b1ad-d26e3ae2d018.json,Jetty Steel Systems / Voxel Call,video_and_investigation,Data overload management via Boards and filtered default views,"Reduce data overload by creating Boards filtered by incident, camera, or shift, set as user defaults, and surface weekly top opportunities with a few representative clips.","there was just a load of stuff in there. It's like, well, what do we do with it, right?... make it more digestible? || we have the ability to create a board based on incident types, cameras, and also shifts... We can make boards a default for anyone... When I log into Voxel, I land right on the board. || This is a collection of two to four opportunities... I have just five video examples here. So forget thousands. It's just the top five.",mixed,0.0425531914893617,False,False,False,,
982938ec-9d24-4ef2-bb60-371bad4fc8f5.json,Mesa Span Solutions + Voxel Demo,efficiency_and_operations,Protect laser-guided vehicles (AGVs) from damage,Safeguard expensive laser-guided vehicles from damage caused by forklift operators to avoid costly downtime and repairs.,"the new laser-guided vehicles that were obviously expensive, but forklift drivers and operators potentially crashing into those or causing havoc with those or risk around those.",customer_only,0.125,False,False,True,,
03a609d7-bd48-48aa-a708-650afb1d3a58.json,Orion Forge Industrial // Voxel,efficiency_and_operations,Vehicle idling monitoring (ports),Monitor idling to enforce operational policies and reduce fuel/emissions alongside speeding enforcement.,"No speeding, no idling, suspended load when they're moving those, you know, those large boxes.",voxel_only,0.07142857142857142,False,False,True,,
62eb5dc9-c22f-4846-92dd-07743da36faf.json,Voxel Follow Up,reporting_and_analytics,Evaluate value using claims and injury trends,Assess program value by reviewing claims context alongside injury trends over time.,"That was one of the things that Doug wanted to get a better handle on. || an average work comp claim is about REDACTED to REDACTED. || And if we were to prevent a few injuries, at least with Plant City, it pays for itself || on average, REDACTED per injury, so two to three, two and a half to a few injuries avoided typically will pay for itself.",mixed,0.02702702702702703,False,True,True,,
ac14b2a4-2a18-45c0-9f6d-3956fb2f1e85.json,Jordan/Riley - Introduction,video_and_investigation,Driver exoneration using video evidence after a crash,Use in-vehicle video to exonerate drivers at the scene of a collision and reduce claims exposure.,"They called us and they're like, hey, we need to get some vintage. || We're so happy that we have Beacon Ridge Telematics. They was actually able to exonerate their driver right on the scene. || It had nothing to do with the driver. was the other driver that had a head-on collision with them.",customer_only,0.030303030303030304,True,False,True,,
1511c2ce-9507-4d8c-b99a-60e5bc21016f.json,Iron Forge Industrial | Voxel,adoption_and_enablement,Ongoing partnership and customer success support,"They want a partner that remains engaged after rollout, rather than a one-off tool.","Because that's what we're kind of, we're looking for a partner, not just, you know, a cool new toy at one site that we can show off to leadership, right? || it's not like you start using the product and then stop hearing from us; we stay involved to help you moving forward. || We have people who help make sure the setup is aligned, the goals are clear, and the reviews stay on track. || And then you have ongoing customer support after that as well.",mixed,0.04,False,True,False,,
be401ee4-de53-401a-b1ad-d26e3ae2d018.json,Jetty Steel Systems / Voxel Call,reporting_and_analytics,Heatmap-based prioritization of reviews,Use heatmaps and by-camera filters to focus reviews on hotspots without sifting through all incidents.,"what this allows you to do is, based on this information here for the last about a month in this camera view, you can see through the control box view where are these events happening the most. || that heat map is definitely a good one... it helps you, like you said, home in or focus on, from a priority perspective of just where is this happening the most?",mixed,0.0,False,True,False,,
37033189-bb15-419d-bd12-d9c07c44acbd.json,Impromptu Anchor Point Meetings Meeting,workflow_and_accountability,Skeleton overlay on action videos to aid review,Include human pose/skeleton overlays on action videos so reviewers can quickly understand what occurred.,"I actually want to thank you for finally adding the skeleton on the action videos or the assign action videos. || So when I get assignments and I don't see the skeleton, I get lost.",customer_only,0.15789473684210525,False,True,False,,
af1e5ada-5bd5-4ce2-951d-f679daeb15db.json,River Ridge Works | Voxel Sync,compliance_and_quality,AI governance and security compliance review,Any AI solution must pass an internal AI governance board review and complete security and AI questionnaires before proceeding.,"Like, I learned that we have an AI board now who review AI things. || we have basically a security and AI questionnaire. || And because it, it all, it all goes, I guess gets reviewed by them.",customer_only,0.09523809523809523,False,True,False,,
b5715671-0f5a-4f2a-9584-43420ff6ebc4.json,Cedar Field Materials // Voxel (Camera Assessment),workflow_and_accountability,Trial validation of detection and workflow integration,"During the trial, validate that Voxel detects the targeted events, that the platform and data workflows fit Cedar Field Materials’s processes, and establish an action plan based on identified opportunities.","It does, Voxel actually pick up the things that we say we're going to, so detection capabilities. || the trends and just getting the data in there, the interoperability with the platform, right? Making sure you like the way it works and that it fits with your workflow. || starting to put a plan in place for taking action on those opportunities for improvement.",voxel_only,0.05128205128205128,False,True,False,,
62eb5dc9-c22f-4846-92dd-07743da36faf.json,Voxel Follow Up,adoption_and_enablement,Broaden platform engagement via role-based access and targeted boards,Increase adoption by involving supervisors and broader teams with contributor roles and shift/incident-specific boards so each leader sees only relevant items and can review quickly.,"We've got six, eight, ten people with login that can come in, can make an observation, can give a positive comment, can maybe provide some insights on what they're seeing. || We now have a contributor role where they're only seeing what you guys want them to see. || Yesterday has had all cameras now on that board showing for pit to pit. || But we can separate it by shift. || Yeah, that may make it more manageable for, you know, if we're trying to push things down to leaders to say, hey, a leader's going to log in and he's only going to see things that impact his shift.",mixed,0.015151515151515152,False,True,False,,
dd2a6900-b843-4234-88ac-ecaa37ab4750.json,Voxel <> Noble Base Supply continued ,video_and_investigation,Reduce time spent on manual observations,Use automated video analyses to quickly surface risk areas and save time compared to standing on the floor observing workers.,"within 10, 15 seconds of clicking on this, this use case in the platform, you're going to be able to target that area of concern very quickly. I'm going to save you time from, you know, standing out there all day and watching two, three people.",voxel_only,0.03125,False,False,False,,
7bd67fba-1240-4bfc-afeb-48f18488ad85.json,Quick Sync- Taylor @ Northern Chill Logistics,workflow_and_accountability,Advance notification of platform/UI changes,"Wants proactive communication about product changes (e.g., migration from resolutions to Actions) so he and his boss aren’t surprised.","Like, it makes me a little uncomfortable that I keep finding out about things like after it happens, you know what I mean? || maybe, you know, you could let me know a little bit ahead of time. || let my boss know because like, you know what I mean? || And I believe you had some other questions just about notifications and things of that nature.",mixed,0.0,False,False,False,,
096964ad-8b87-401e-933c-984c56c0da56.json,Gray Connect,asset_and_loss_prevention,Change management impact tracking and leadership storytelling,"Measure the effects of interventions with Voxel data and build a clear before/after story to present to leadership, including course corrections based on platform feedback.","It'd be really nice to have some data around, like, hey, we identified this issue of Zone Red. || Here are the steps we took. || Here's what the platform told us. || So actually implementing it, I think, is the next step, and I'll get with the steer co, and we can see what we can do to really push that in the next couple of weeks to actually measure what we're doing and get you guys a story to tell to leadership.",mixed,0.022222222222222223,False,False,False,,
6a0e07b5-9bef-4c88-80ad-9a732f2dbb91.json,Mason Line Supply / Voxel introduction,compliance_and_quality,Door open/propped duration monitoring,Alert when warehouse doors are left open or propped to reduce security exposure from unauthorized entry.,"This one's not just safety, but it's kind of a security element as well. When we see that the door is open for a certain amount of time, let's alert on that. Let's not leave the warehouse open and susceptible to strangers coming into the warehouse. || Boom. That's why your door's propped open. He just put a stick in the door.",voxel_only,0.09090909090909091,True,False,True,,
dd6490e5-9b50-4589-ab35-4245c3becc1c.json,Kodiak Point Fabrication/Kodiak Point Fabrication + Voxel - Deployment Sync,efficiency_and_operations,Parking duration monitoring,Track parking duration/dwell time in areas such as the lot or truck wash to understand how long vehicles remain parked.,"Stopping and Starting, Parking, || Truck Wash, curious, || no, we haven't got a parking duration there yet",voxel_only,0.18181818181818182,False,False,False,,
